{
  "schema_version": "flow.run-state/v1",
  "sequence": 2,
  "previous_digest": "cccccccccccccccccccccccccccccccccccccccccccccccccccccccccccccccc",
  "plan_digest": "0e91d3a2af624fd222d6cf2aa1b005b8d9b3ad2f3e9951cde35b2e9e99b102d1",
  "plan": {
    "schema_version": "flow.run-plan/v1",
    "plan_id": "plan:durable-example",
    "run_id": "run:durable-example",
    "steps": [
      {
        "step_id": "step:inspect",
        "depends_on": [],
        "context": {
          "run_id": "run:durable-example",
          "invocation_id": "invocation:durable-example",
          "invocation_digest": "1111111111111111111111111111111111111111111111111111111111111111",
          "provider": {
            "extension_id": "org.egohygiene.synthetic-adapters",
            "version": "0.1.0",
            "publisher_id": "org.egohygiene",
            "integrity": "1111111111111111111111111111111111111111111111111111111111111111"
          },
          "interface": {
            "kind": "process",
            "name": "synthetic-process",
            "protocol": "flow.extension-invocation/v1"
          },
          "capability_id": "optiflow/inspect-collection",
          "capability_digest": "2222222222222222222222222222222222222222222222222222222222222222",
          "configuration_schema": "synthetic.optiflow-inspect/v1",
          "configuration_digest": "3333333333333333333333333333333333333333333333333333333333333333",
          "configuration_values_digest": "44136fa355b3678a1146ad16f7e8649e94fb4fc21fe77e8310c060f61caaff8a",
          "subject_lock_digest": "4444444444444444444444444444444444444444444444444444444444444444",
          "authorization_id": "authorization:durable-example",
          "authority_profile_digest": "5555555555555555555555555555555555555555555555555555555555555555",
          "enforcement_evidence_digest": "6666666666666666666666666666666666666666666666666666666666666666",
          "grants_digest": "7777777777777777777777777777777777777777777777777777777777777777",
          "bindings": {
            "schema_version": "flow.artifact-bindings/v1",
            "binding_set_id": "bindings:synthetic-optiflow-scan",
            "digest_algorithm": "sha256",
            "inputs": [
              {
                "artifact_id": "artifact:synthetic-collection",
                "port": "port:collection",
                "media_type": "application/vnd.flow.collection-reference+json",
                "kind": "file",
                "locator": "inputs/source collection.json",
                "expected_digest": "2222222222222222222222222222222222222222222222222222222222222222"
              }
            ],
            "outputs": [
              {
                "artifact_id": "artifact:synthetic-collection-evidence",
                "port": "port:evidence",
                "media_type": "application/vnd.optiflow.collection-evidence+json",
                "kind": "directory",
                "locator": "outputs/evidence bundle"
              }
            ]
          }
        }
      }
    ]
  },
  "steps": [
    {
      "step_id": "step:inspect",
      "attempt": 1,
      "status": "succeeded",
      "checkpoint": {
        "schema_version": "flow.run-checkpoint/v1",
        "checkpoint_id": "checkpoint:example",
        "plan_digest": "0e91d3a2af624fd222d6cf2aa1b005b8d9b3ad2f3e9951cde35b2e9e99b102d1",
        "context_digest": "216e6c91a49e420820ba87e6add8824c06cc279bf413f67529f276afde1f2049",
        "attempt": 1,
        "artifacts": [
          {
            "schema_version": "flow.run-artifact/v1",
            "role": "input",
            "observation": {
              "artifact_id": "artifact:synthetic-collection",
              "port": "port:collection",
              "media_type": "application/vnd.flow.collection-reference+json",
              "kind": "file",
              "locator": "inputs/source collection.json",
              "digest": "2222222222222222222222222222222222222222222222222222222222222222",
              "size_bytes": 128,
              "manifest": []
            }
          },
          {
            "schema_version": "flow.run-artifact/v1",
            "role": "output",
            "observation": {
              "artifact_id": "artifact:synthetic-collection-evidence",
              "port": "port:evidence",
              "media_type": "application/vnd.optiflow.collection-evidence+json",
              "kind": "directory",
              "locator": "outputs/evidence bundle",
              "digest": "51495603e74938fc7b5f86c3ae1d01ba4f9aaccf29dfe8ad26ea49bbd1ca864a",
              "size_bytes": 384,
              "manifest": [
                {
                  "locator": "summary.json",
                  "kind": "file",
                  "digest": "5555555555555555555555555555555555555555555555555555555555555555",
                  "size_bytes": 256
                },
                {
                  "locator": "évidence",
                  "kind": "directory",
                  "digest": "1e1b8003aaea7b8f60b4481e20c3ad61e627d84d54d2d459109d41b3b01799c2",
                  "size_bytes": 128
                },
                {
                  "locator": "évidence/details.json",
                  "kind": "file",
                  "digest": "6666666666666666666666666666666666666666666666666666666666666666",
                  "size_bytes": 128
                }
              ]
            }
          }
        ],
        "validation": {
          "schema_version": "flow.run-validation/v1",
          "profile": "flow.accept-artifacts/v1",
          "implementation_version": "0.1.0",
          "implementation_digest": "aaaaaaaaaaaaaaaaaaaaaaaaaaaaaaaaaaaaaaaaaaaaaaaaaaaaaaaaaaaaaaaa",
          "platform": "linux",
          "invocation_digest": "1111111111111111111111111111111111111111111111111111111111111111",
          "execution_digest": "bbbbbbbbbbbbbbbbbbbbbbbbbbbbbbbbbbbbbbbbbbbbbbbbbbbbbbbbbbbbbbbb",
          "artifacts_digest": "b054d38b4f2ca943473fab2217e6386c642b3e4bce46e3b43ef07bcfabae6022"
        }
      },
      "failure": null
    }
  ],
  "authority_decisions": [
    {
      "schema_version": "flow.run-authority/v1",
      "step_id": "step:inspect",
      "attempt": 1,
      "granted": true,
      "authorization_id": "authorization:durable-example",
      "profile_digest": "5555555555555555555555555555555555555555555555555555555555555555",
      "enforcement_digest": "6666666666666666666666666666666666666666666666666666666666666666",
      "grants_digest": "7777777777777777777777777777777777777777777777777777777777777777"
    }
  ],
  "recovery_decisions": []
}
